name,ingredients,prep_time,cook_time,directions,add_to_groceries
soup,"1 carrot, 1 celery, 1 onion, 1 chicken stock, 1 chicken",20,40,"cut vegetables, put chicken in pot, cook chicken, shred chicken, cook vegetables, put in chicken stock, simmer, serve",False
chili,"1 carrot, 1 celery, 1 onion, 1 beef stock, 1 beef",20,40,"cut vegetables, put beef in pot, cook beef, cook vegetables, put in beef stock, simmer, serve",False
chicken and rice,"1 chicken, 1 rice, 1 chicken stock",10,30,"cut chicken into pieces, cook in pot, add rice and chicken stock, simmer for 20 minutes",False
chicken and rice 2,"1 chicken, 1 rice, 1 chicken stock, 1 onion",10,30,"cut chicken and onion into pieces, cook in pot, add rice and chicken stock, simmer for 20 minutes",False
turkey sandwich,"1 bread, 1 lettuce, 2 tomato, 1 turkey",5,5,"put ingredients on bread, enjoy",False
onion,1 onion,1,1,onion,False
chicken sandwich,"1 bread, 1 lettuce, 1 tomato, 1 chicken",5,5,"put ingredients on bread, enjoy",False
pasta,"1 tomato, 1 pasta, 1 olive oil",5,15,"cook pasta, add tomato and olive oil",True
